record_id,vedecky_nazev,cesky_nazev,status_v_CR,cast_rostliny,domena,poddomena,status_znalosti,aplikovatelnost_v_CR,typicke_lokality_v_CR,obdobi_ziskani,fenologicka_faze,zpusob_pripravy_nebo_vyuziti,cilovy_efekt,chutovy_profil,vonny_profil,palivovy_potencial,hlavni_rizika,kontraindikace_interakce,legalita_poznamka_CR,dukaznost_typ,dukaznost_skore,zdroj_id_1,zdroj_id_2,poznamka,record_numeric_id,is_trvanlive_1m_plus,is_jadro_bezne_1m_plus,domena_slug,status_znalosti_slug,aplikovatelnost_slug,dukaznost_rank,ma_druhy_zdroj,obdobi_mesic_od,obdobi_mesic_do,cast_rostliny_skupina,cast_rostliny_je_kombinovana,poddomena_kategorie,poddomena_kategorie_confidence,status_contains_puvodni,status_contains_zdomacnely,status_contains_pestovany,status_contains_zplanujici,status_contains_invazni,status_cetnost
R209,Artemisia vulgaris,pelyněk černobýl,"původní, velmi běžný",nať,pití,hořký bylinný nálev,téměř zapomenuté,střední,"náspy, meze, ruderály, okraje cest",VII–VIII,na počátku kvetení,Nať usušit a používat po malém množství v hořkých čajových směsích.,Dlouhodobá zásoba výrazně hořké byliny pro velmi střídmé užití.,"silně hořký, kořenitý",silně bylinný,neaplikovatelné,Snadné předávkování chutí i účinkem; není vhodný jako běžný pitný čaj.,Nevhodné v těhotenství; opatrnost u citlivých osob a u dětí.,Sběr běžně možný mimo znečištěná místa.,folklórní bylinná praxe / botanický zdroj,C,S68,,Zařazeno spíš jako kurátorský a zapomenutý typ užití než jako univerzální doporučení.,209,True,False,piti,temer_zapomenute,stredni,3,False,7,8,listova_nadzemni_cast,False,caj_nalev,medium,True,False,False,False,False,velmi_bezny
R210,Berberis vulgaris,dřišťál obecný,"původní/pěstovaný, lokálně běžný",plod,potrava,sušené plody jako kyselý dochucovač,méně známé,střední,"živé ploty, křoviny, teplejší stráně, zahrady",IX–X,plně vybarvené kyselé plody,"Plody usušit a používat po malém množství do rýže, omáček nebo směsí.",Velmi trvanlivý kyselý komponent z opomíjeného keře.,"výrazně kyselý, svíravý","ovocný, lehce pryskyřičný",neaplikovatelné,Záměna s okrasnými dřišťály; sbírat jen dobře určené plody.,Kořeny a kůra obsahují berberin a nepatří do domácí samoléčby; zde jde o plody.,Sběr běžně možný u nechráněných a čistých keřů.,botanický zdroj + širší euroasijská kulinární praxe,B,S71,,Výborný příklad světového poznání dobře přenositelného do ČR.,210,True,True,potrava,mene_zname,stredni,4,False,9,10,plodova_cast,False,koreni_dochucovadlo,medium,True,False,True,False,False,lokalne_bezny
R211,Berberis vulgaris,dřišťál obecný,"původní/pěstovaný, lokálně běžný",plod,pití,sirup nebo želé z plodů,méně známé,střední,"živé ploty, křoviny, zahrady, teplejší lokality",IX–X,plně zralé plody,Plody povařit na sirup nebo želé; dobře zavařit.,Převod velmi kyselých plodů do použitelné a skladovatelné formy.,"intenzivně kyselý, ovocný",ovocný,neaplikovatelné,Silná kyselost; nutné dostatečné doslazení a správné zavaření.,"Běžné potravní užití plodů je v pořádku, ale neplést s léčivým použitím kůry/kořenů.","Sběr z běžných, čistých keřů.",botanický zdroj + kulinární praxe,B,S71,,"Pro českou databázi cenné právě jako méně známý, ale dobře přenositelný keřový zdroj.",211,True,True,piti,mene_zname,stredni,4,False,9,10,plodova_cast,False,sirup_koncentrat,medium,True,False,True,False,False,lokalne_bezny
R212,Quercus robur / Q. petraea,dub letní / dub zimní,"původní, běžný",žalud,potrava,usušené žaludy k pozdějšímu zpracování,téměř zapomenuté,vysoká,"doubravy, parky, aleje, remízky, lesní okraje",IX–XI,zralé žaludy bez červivosti,Žaludy dosušit a uchovat v suchu jako zásobu pro pozdější vyluhování a další zpracování.,Praktický mezikrok mezi sběrem a pozdější pracnou úpravou.,"trpký, škrobnatý",slabý,neaplikovatelné,"Červivost, plísně a vysoký obsah tříslovin bez následného vyluhování.",Bez řádného vyluhování nejsou vhodné k běžné konzumaci.,"Běžný sběr z nechráněných stromů, nepoškozovat dřeviny.",botanický zdroj + moderní potravní přehled,B,S64,S78,"Samotné usušení není konečný potravní produkt, ale velmi užitečný skladovací krok.",212,True,True,potrava,temer_zapomenute,vysoka,4,True,9,11,semena_a_orisky,False,suseni_skladovani,medium,True,False,False,False,False,bezny
R213,Quercus robur / Q. petraea,dub letní / dub zimní,"původní, běžný",žalud,potrava,žaludová mouka po vyluhování a dosušení,téměř zapomenuté,střední,"doubravy, parky, aleje, lesní okraje",IX–XI,zralé zdravé žaludy,"Žaludy rozmělnit, vyluhovat třísloviny, hmotu znovu dosušit a umlít na mouku.","Zapomenutá, ale reálně použitelná dlouhodobá zásoba z běžného stromu.","jemně oříškový, škrobnatý, po úpravě neutrálnější",slabý,neaplikovatelné,Nedostatečné vyluhování zanechá nadměrnou trpkost a může dráždit trávení.,Nejde o rychlý produkt; hlavní bezpečnostní krok je důkladné vyluhování.,"Sbírat běžně lze, nepoškozovat strom.",botanický zdroj + moderní potravní přehled,B,S64,S78,Do databáze zařazeno kvůli vysoké praktické i historické hodnotě.,213,True,True,potrava,temer_zapomenute,stredni,4,True,9,11,semena_a_orisky,False,mouka_skrob,high,True,False,False,False,False,bezny
R214,Fagus sylvatica,buk lesní,"původní, běžný",bukvice,potrava,pražené bukvice jako zimní zásoba,téměř zapomenuté,střední,"bučiny, parky, lesní okraje, aleje",IX–X,zralé bukvice po opadu,"Bukvice oloupat, tepelně upravit a střídmě skladovat jako oříškovou zásobu.",Zapomenutý lesní zdroj s krátkým sběrovým oknem a slušnou trvanlivostí.,"olejnatý, jemně sladký, oříškový",oříškový,neaplikovatelné,Syrové a ve větším množství nevhodné; vysoký obsah tuku zkracuje skladování.,Nejíst ve velkém a ne syrové.,Běžný sběr spadlých zdravých bukvic v nechráněných lokalitách.,botanický zdroj,B,S65,,"Po upražení jde o zajímavou, ale dnes už téměř zapomenutou lesní zásobu.",214,True,True,potrava,temer_zapomenute,stredni,4,False,9,10,semena_a_orisky,False,ostatni_specialni,low,True,False,False,False,False,bezny
R215,Fagus sylvatica,buk lesní,"původní, běžný",bukvice,pití,pražené bukvice jako kávová náhražka,téměř zapomenuté,střední,"bučiny, lesní cesty, parky",IX–X,zralé bukvice,"Bukvice upražit, umlít a použít jako kávovou náhražku.",Jeden z málo známých nápojových výstupů z běžného lesa.,"pražený, oříškový",praženě oříškový,neaplikovatelné,Žluknutí při dlouhém skladování mleté suroviny; syrové bukvice nejsou vhodné ve velkém.,Není to běžný denní nápoj; hlavní riziko je technologické a dávkové.,Běžný sběr bez poškození stromů.,botanický zdroj,B,S65,,"Silný „zapomenutý“ záznam, ale při dobré úpravě prakticky použitelný.",215,True,True,piti,temer_zapomenute,stredni,4,False,9,10,semena_a_orisky,False,kavova_nahrada,medium,True,False,False,False,False,bezny
R216,Fagus sylvatica,buk lesní,"původní, běžný",bukvice,potrava,olej z bukvic,téměř zapomenuté,nízká až střední,"bučiny, parky, lesní okraje",IX–X,plně zralé bukvice,Po vyloupání lze lisovat olej; v praxi spíše malovýrobní nebo historická kuriozita.,Vzácná a zapomenutá tuková forma z běžného stromu.,"olejnatý, jemný",jemně oříškový,neaplikovatelné,Nízký výnos a pracnost; zbytky po lisování nejsou vhodné.,Důraz na střídmost a čisté zpracování.,Jen šetrný sběr.,botanický zdroj / historický analog,C,S65,,"Zařazeno kvůli vysoké dokumentační hodnotě, ne kvůli snadné praxi.",216,True,False,potrava,temer_zapomenute,nizka_az_stredni,3,False,9,10,semena_a_orisky,False,olej,high,True,False,False,False,False,bezny
R217,Betula pendula,bříza bělokorá,"původní, běžná",kůra,palivo,březová kůra jako troud a nouzový podpal,mainstream,vysoká,"světlé lesy, nálety, okraje cest, paseky, březiny",celoročně,suchá odlupující se kůra ze spadlých nebo pokácených částí,Suchou kůru skladovat v suchu; jemně naškrábaná slouží jako spolehlivý troud.,Jedna z nejpraktičtějších dlouhodobě skladovatelných podpalových surovin v české krajině.,neaplikovatelné,papírově pryskyřičný při hoření,vysoký jako troud; rychlý záchyt plamene,Nestrhávat kůru z živých stromů; vlhká kůra funguje hůře.,Neaplikovatelné.,Používat jen opadanou nebo z již pokáceného dřeva.,technický palivový zdroj,B,S12,S13,Dobrý příklad trvanlivého „výletového“ palivového materiálu.,217,True,True,palivo,mainstream,vysoka,4,True,1,12,drevnata_cast,False,palivo,medium,True,False,False,False,False,bezny
R218,Taraxacum officinale agg.,pampeliška lékařská,"původní, velmi běžná",kořen,pití,sušený kořen do zásoby pro pozdější pražení,méně známé,vysoká,"louky, trávníky, meze, sady, okraje cest",III–IV a IX–XI,silnější kořeny před kvetením nebo po zatažení natě,"Kořen nakrájet, usušit a skladovat; pražit až těsně před mletím nebo průběžně.",Velmi praktická spížní surovina z extrémně běžné rostliny.,"po pražení kávově hořký, zemní",po pražení jemně kávový,neaplikovatelné,Kořeny z městských psích a postřikovaných ploch nejsou vhodné.,Při potížích se žlučníkem opatrnost; potravně jde o běžnou náhražku kávy.,Běžný sběr z čistých ploch.,EMA + botanický zdroj,A,S31,S61,Odlišeno od okamžité přípravy kávy – zde jde přímo o skladovanou meziformu.,218,True,True,piti,mene_zname,vysoka,5,True,3,11,podzemni_cast,False,suseni_skladovani,medium,True,False,False,False,False,velmi_bezny
R219,Taraxacum officinale agg.,pampeliška lékařská,"původní, velmi běžná",květ,pití,pampeliškový sirup / „med“,mainstream,vysoká,"louky, trávníky, sady, meze",IV–V,plně otevřené květy za sucha,"Květy převařit či vylouhovat, zkoncentrovat s cukrem a zavařit.",Praktický způsob uchování velmi krátké květní sezóny.,"sladký, lehce bylinný, květový",jemně květový,neaplikovatelné,Květy z městských a psích ploch nejsou vhodné; příliš řídký sirup má kratší trvanlivost.,Vysoký obsah cukru; nejde o léčivý přípravek.,Běžný sběr z čistých ploch.,tradiční domácí praxe + botanický zdroj,B,S61,,Dobře uzavřený sirup běžně vydrží měsíce.,219,True,False,piti,mainstream,vysoka,4,False,4,5,kvetni_cast,False,sirup_koncentrat,medium,True,False,False,False,False,velmi_bezny
R220,Urtica dioica,kopřiva dvoudomá,"původní, velmi běžná",semeno,potrava,sušená kopřivová semena jako zásobní přísada,méně známé,střední,"ruderály, zahrady, křoviny, dusíkatá místa, okraje cest",VIII–IX,zralá semena zejména ze samičích rostlin,"Semena dosušit a používat po malých dávkách do kaší, müsli nebo směsí.",Dlouhodobě skladovatelný a stále ještě poměrně málo využívaný výstup z velmi běžné rostliny.,"oříškový, travnatý",slabý,neaplikovatelné,Prach a drobné chloupky mohou dráždit při sklizni; snadné znečištění prachem.,Opatrnost u citlivých osob; nezačínat vysokými dávkami.,"Sbírat z čistých dusíkatých lokalit, ne u silnic.",botanický zdroj / moderní wild-food praxe,B,S60,,Dobře usušené semeno vydrží měsíce.,220,True,True,potrava,mene_zname,stredni,4,False,8,9,semena_a_orisky,False,suseni_skladovani,medium,True,False,False,False,False,velmi_bezny
R221,Urtica dioica,kopřiva dvoudomá,"původní, velmi běžná",list,potrava,sušený kopřivový prášek do zásoby,méně známé,vysoká,"zahrady, dusíkatá místa, okraje křovin, vlhčí ruderály",III–V,mladé zdravé listy před plným kvetením,Listy usušit dokřupava a rozemlít na jemný zelený prášek pro pozdější přidávání do jídel.,Kompaktní dlouhodobá zásoba minerálně bohaté jarní zeleniny.,"zelený, travnatý, lehce minerální",slabě bylinný,neaplikovatelné,Špatně usušený materiál plesniví; sbírat jen mladé listy z čistých míst.,V běžném potravním užití obvykle bez zásadních problémů.,Běžný sběr z čistých lokalit.,botanický zdroj + moderní wild-food praxe,B,S60,,"Velmi praktický „wild pantry“ produkt, který v databázi zvyšuje užitnou hodnotu kopřivy.",221,True,True,potrava,mene_zname,vysoka,4,False,3,5,listova_nadzemni_cast,False,suseni_skladovani,medium,True,False,False,False,False,velmi_bezny
R222,Crataegus monogyna Jacq. / C. laevigata (Poir.) DC.,hloh obecný / jednosemenný,"původní, běžný",plod,pití,sušené hložinky do čajových směsí,méně známé,vysoká,"křoviny, živé ploty, meze, lesní okraje, pastviny",IX–XI,plně zralé červené plody,Plody usušit a po malém množství přidávat do bylinných směsí nebo odvarů.,"Dlouhodobá zásoba z extrémně běžného keře, který se často míjí bez povšimnutí.","jemně moučný, ovocný",slabě ovocný,neaplikovatelné,Přezrálé plody se suší hůře; nutné dobré určení druhu.,U kardiálních potíží nejde o náhradu léčby; zde jde o tradiční potravně-nápojové použití.,Běžný sběr z čistých keřů.,EMA + botanický zdroj,B,S32,S53,"Vhodné jako méně známý, ale velmi dostupný „hedgerow pantry“ záznam.",222,True,True,piti,mene_zname,vysoka,4,True,9,11,plodova_cast,False,caj_nalev,medium,True,False,False,False,False,bezny
R223,Sorbus aucuparia,jeřáb ptačí,"původní, běžný",plod,pití,jeřabinový likér / cordial,méně známé,vysoká,"lesní okraje, horské a podhorské cesty, parky, aleje",IX–XI,plně zralé plody ideálně po mrazu nebo po zamražení,Plody naložit do alkoholu nebo povařit na cordial; teplem či mrazem zjemnit trpkost.,Jedna z nejzajímavějších trvanlivých forem využití běžného horského a parkového stromu.,"kyselý, trpký, hořkosladký",ovocný,neaplikovatelné,Syrové a ve velkém nejsou vhodné; nutná úprava.,Obsah alkoholu u likérů; jinak hlavní riziko je technologické.,Běžný sběr z nechráněných stromů.,botanický zdroj + středoevropská praxe,B,S53,,"Dobrý příklad „svět použitelného jeřábu“, který se v běžných českých přehledech ztrácí.",223,True,True,piti,mene_zname,vysoka,4,False,9,11,plodova_cast,False,sirup_koncentrat,medium,True,False,False,False,False,bezny
R224,Sorbus aucuparia,jeřáb ptačí,"původní, běžný",plod,pití,sušené jeřabiny do čajových směsí,téměř zapomenuté,střední,"podhorské cesty, lesní okraje, parky, remízky",IX–XI,zralé plody po zjemnění mrazem nebo zamražením,Plody dosušit a používat po malém množství do směsí nebo odvarů.,"Zapomenutá, ale trvanlivá forma z výrazných podzimních plodů.","kyselý, trpký",slabě ovocný,neaplikovatelné,Bez předúpravy velmi trpké; nepoužívat ve velkém syrové.,Hlavní je potravní a technologická opatrnost.,Běžný sběr čistých plodů.,botanický zdroj / tradiční praxe,B,S53,,Zařazeno kvůli vysoké dostupnosti stromu a malé známosti této formy.,224,True,False,piti,temer_zapomenute,stredni,4,False,9,11,plodova_cast,False,caj_nalev,medium,True,False,False,False,False,bezny
R225,Prunus spinosa,trnka obecná,"původní, velmi běžná",plod,pití,trnkový likér,mainstream,vysoká,"živé ploty, meze, okraje polí, křoviny, náspy",IX–XI,plně zralé plody ideálně po prvních mrazících nebo po zamražení,Plody naložit do alkoholu s cukrem; nechat vyluhovat a dlouhodobě skladovat.,Jeden z nejpraktičtějších trvanlivých produktů z běžných českých křovin.,"trpkosladký, ovocný, mandlový v pozadí",ovocný,neaplikovatelné,Příliš nezralé plody jsou velmi svíravé; pecky nenechávat rozbité.,Obsah alkoholu; jinak potravní užití po maceraci je tradiční.,Běžný sběr čistých plodů z nechráněných keřů.,botanický zdroj + evropská tradiční praxe,B,S72,,"Klasická forma, ale do tohoto workbooku dobře zapadá jako „výletově dostupný“ likér.",225,True,True,piti,mainstream,vysoka,4,False,9,11,plodova_cast,False,liker_macerat,medium,True,False,False,False,False,velmi_bezny
R226,Prunus spinosa,trnka obecná,"původní, velmi běžná",plod,pití,sušené trnky do čajových směsí,téměř zapomenuté,střední,"živé ploty, křoviny, meze, okraje polí",X–XI,zralé plody po změknutí mrazem nebo po zmražení,Plody usušit a po malém množství přidávat do směsí nebo ovocných odvarů.,Méně známá a velmi trvanlivá forma z běžně dostupných plodů.,"svíravý, ovocný",slabě ovocný,neaplikovatelné,Bez změknutí mrazem bývají chuťově tvrdé a velmi trpké.,Nejde o rychlou kuchyňskou surovinu; vyžaduje trpělivé zpracování.,Běžný sběr čistých plodů.,botanický zdroj,B,S72,,Dobře vystihuje „téměř zapomenutou“ logiku databáze.,226,True,False,piti,temer_zapomenute,stredni,4,False,10,11,plodova_cast,False,caj_nalev,medium,True,False,False,False,False,velmi_bezny
R227,Prunus spinosa,trnka obecná,"původní, velmi běžná",nezralý plod,potrava,nakládané nezralé trnky jako „olivy“,téměř zapomenuté,střední,"živé ploty, meze, křoviny",VI–VII,tvrdé nezralé plody,Mladé plody naložit do slaného nebo kyselého nálevu podobně jako olivy.,"Kuriózní, ale doložená a trvanlivá forma z běžného keře.","slanokyselý, svíravý",slabý,neaplikovatelné,Je to specialita; chuť je výrazná a ne pro každého.,"Hlavní riziko je technologické, nikoli léčebné.",Sběr běžně možný z nechráněných keřů.,botanický zdroj / izolovanější evropský kulinární záznam,C,S72,,"Přesně ten typ okrajového, ale fascinujícího záznamu, který jsi chtěl zachovat.",227,True,False,potrava,temer_zapomenute,stredni,3,False,6,7,plodova_cast,False,ostatni_specialni,low,True,False,False,False,False,velmi_bezny
R228,Galium aparine,svízel přítula,"původní, velmi běžný",semeno,pití,pražená semena jako kávová náhražka,téměř zapomenuté,střední,"ploty, křoviny, ruderály, okraje zahrad, živé ploty",VII–IX,zralé suché plody/semena,"Semena dosušit, lehce opražit a umlít jako kávovou náhražku.",Jeden z nejzajímavějších „plevelných“ trvanlivých nápojových produktů.,po pražení kávově travnatý,po pražení jemně pražený,neaplikovatelné,Pracnost sběru; snadné znečištění semene.,Nejde o léčivý čaj; hlavní je čistota sběru a mírné očekávání chuti.,Běžný sběr z čistých lokalit.,botanický zdroj,B,S73,,Výborný příklad běžně přehlížené rostliny s opravdu zajímavým využitím.,228,True,True,piti,temer_zapomenute,stredni,4,False,7,9,semena_a_orisky,False,kavova_nahrada,medium,True,False,False,False,False,velmi_bezny
R229,Geum urbanum,kuklík městský,"původní, velmi běžný",kořen,potrava,sušený kořen jako koření s hřebíčkovým tónem,téměř zapomenuté,střední,"stinné cesty, lesní lemy, parky, křoviny, zdi a dvory",III–V a IX–XI,aromatický kořen nejlépe na jaře nebo na podzim,"Kořen očistit, usušit a jemně dávkovat jako náhradu hřebíčku do nápojů či jídel.",Jedna z nejlepších zapomenutých kořenných zásob z běžných procházek.,"kořenitý, hřebíčkový, lehce skořicový",teplý kořenitý,neaplikovatelné,Záměna s jinými druhy kuklíku; starý kořen bývá méně aromatický.,V běžném kulinárním použití obvykle bez zásadních problémů.,"Běžný sběr z čistých lokalit, šetrně kvůli kořeni.",botanický zdroj,B,S74,,Velmi silný kandidát na „nejlepší další krok“ právě kvůli praktičnosti a malé známosti.,229,True,True,potrava,temer_zapomenute,stredni,4,False,3,11,podzemni_cast,False,koreni_dochucovadlo,medium,True,False,False,False,False,velmi_bezny
R230,Geum urbanum,kuklík městský,"původní, velmi běžný",kořen,pití,sušený kořen do odvaru nebo svařených nápojů,téměř zapomenuté,střední,"lesní cesty, parky, stinné okraje sídel",III–V a IX–XI,čerstvě očištěný aromatický kořen,"Usušený kořen přidávat do odvaru, svařeného vína nebo jiných kořeněných nápojů.",Dlouhodobě skladovatelný aromatický „wild spice“ pro nápoje.,"kořenitý, hřejivý",hřebíčkově kořenitý,neaplikovatelné,Příliš vysoká dávka přebije směs; kořen musí být čistě určen.,Spíše kulinární než léčebné použití.,Běžný sběr z čistých lokalit.,botanický zdroj + tradiční evropská praxe,B,S74,,Do českého workbooku přidává velmi specifickou a praktickou aromatickou linii.,230,True,True,piti,temer_zapomenute,stredni,4,False,3,11,podzemni_cast,False,suseni_skladovani,medium,True,False,False,False,False,velmi_bezny
R231,Geum urbanum,kuklík městský,"původní, velmi běžný",kořen,vůně,usušený kořen do prádla a skříní,téměř zapomenuté,střední,"lesní lemy, stinné parky, cesty, křoviny",III–V a IX–XI,čerstvě vykopaný aromatický kořen,Kořen usušit a vložit do malých sáčků do skříní nebo prádla.,Trvanlivý aromatický a repelenční detail z téměř zapomenuté domácí praxe.,neaplikovatelné,"hřebíčkový, kořenitý",neaplikovatelné,Vůně časem slábne; při vlhku může kořen zatuchnout.,Citlivé osoby mohou hůře tolerovat silné aroma v malém prostoru.,Sbírat šetrně a jen malé množství.,tradiční domácí praxe,C,S75,S74,"Přesně ten typ jednorázovějšího, ale hodnotného detailu, který se v moderních přehledech ztrácí.",231,True,False,vune,temer_zapomenute,stredni,3,True,3,11,podzemni_cast,False,suseni_skladovani,medium,True,False,False,False,False,velmi_bezny
R232,Picea abies,smrk ztepilý,"původní/pěstovaný, velmi běžný",pryskyřice,vůně,smrková pryskyřice jako kadidlo / vykuřovadlo,méně známé,střední,"smrčiny, výsadby, podhorské lesy, zahrady",celoročně,ztvrdlá přirozeně vyteklá pryskyřice,Sbírat jen již ztvrdlé kusy přirozeně vyteklé pryskyřice a pálit po malém množství na uhlíku.,Velmi trvanlivá lesní aromatická surovina.,neaplikovatelné,"silně lesní, pryskyřičný, balzamický",neaplikovatelné,Nesbírat čerstvým poraněním stromu; kouř může dráždit.,Nevhodné pro citlivé dýchací cesty.,"Preferovat samovolně vytuhlou pryskyřici nebo surovinu z řezu, nepoškozovat stromy.",chemicko-etnobotanický zdroj,C,S14,S76,Silná vůně a velmi dlouhá skladovatelnost z ní dělají cenný aromatický záznam.,232,True,True,vune,mene_zname,stredni,3,True,1,12,drevnata_cast,False,vune_a_vykurovani,medium,True,False,True,False,False,velmi_bezny
R233,Rubus fruticosus agg.,ostružiník křovitý,"původní/zdomácnělý, velmi běžný",list,pití,sušený list do zimních čajových směsí,méně známé,vysoká,"křoviny, paseky, náspy, lesní okraje, meze",V–VIII,zdravé listy před přestárnutím,List usušit a používat samostatně nebo ve směsích jako jemný listový čaj.,"Z běžných křovin dělá i dlouhodobou nápojovou zásobu, ne jen zdroj plodů.","jemný, lehce svíravý",slabě listový,neaplikovatelné,Sbírat jen zdravé listy mimo znečištěná místa.,V běžném užití bez zásadních problémů.,Běžný sběr čistých listů.,botanický zdroj / tradiční čajová praxe,B,S48,,Právě listová vrstva křovin bývá v českých přehledech málo akcentovaná.,233,True,True,piti,mene_zname,vysoka,4,False,5,8,listova_nadzemni_cast,False,caj_nalev,medium,True,True,False,False,False,velmi_bezny
R234,Fragaria vesca,jahodník obecný,"původní, běžný",list,pití,sušený jahodníkový list na čaj,méně známé,vysoká,"lesní lemy, světliny, paseky, zahrady, stráně",V–VIII,zdravé listy před úplným přestárnutím,List usušit a použít do jemných listových čajů nebo směsí.,"Nenápadná, ale velmi praktická trvanlivá nápojová forma z běžné lesní rostliny.","jemně travnatý, lehce svíravý",slabý,neaplikovatelné,Sbírat jen zdravé neplesnivé listy.,V běžném užití bez zásadních problémů.,Běžný šetrný sběr listů.,botanický zdroj / tradiční listová praxe,B,S56,,Dobře doplňuje plodové využití jahodníku o skladovatelnou „listovou“ rovinu.,234,True,True,piti,mene_zname,vysoka,4,False,5,8,listova_nadzemni_cast,False,caj_nalev,medium,True,False,False,False,False,bezny
R235,Sambucus nigra,bez černý,"původní, velmi běžný",plod,pití,sušené bezinky do zimních směsí,méně známé,vysoká,"křoviny, remízky, ploty, okraje cest, ruderály",VIII–IX,plně zralé černé plody,"Plody usušit a používat po tepelné úpravě do směsí, odvarů nebo kompotů.",Trvanlivé uchování podzimní bezové sklizně mimo sirupy a džemy.,"ovocný, lehce zemní",slabě ovocný,neaplikovatelné,Syrové plody nejsou vhodné; nutná tepelná úprava nebo rozumné zpracování.,Neužívat syrové ve větším množství.,Běžný sběr z čistých keřů.,česká etnobotanika + botanický zdroj,B,S01,S59,Praktická a stále trochu opomíjená forma dlouhodobého využití bezu.,235,True,True,piti,mene_zname,vysoka,4,True,8,9,plodova_cast,False,suseni_skladovani,medium,True,False,False,False,False,velmi_bezny
