record_id,vedecky_nazev,cesky_nazev,status_v_CR,cast_rostliny,domena,poddomena,status_znalosti,aplikovatelnost_v_CR,typicke_lokality_v_CR,obdobi_ziskani,fenologicka_faze,zpusob_pripravy_nebo_vyuziti,cilovy_efekt,chutovy_profil,vonny_profil,palivovy_potencial,hlavni_rizika,kontraindikace_interakce,legalita_poznamka_CR,dukaznost_typ,dukaznost_skore,zdroj_id_1,zdroj_id_2,poznamka,record_numeric_id,is_trvanlive_1m_plus,is_jadro_bezne_1m_plus,domena_slug,status_znalosti_slug,aplikovatelnost_slug,dukaznost_rank,ma_druhy_zdroj,obdobi_mesic_od,obdobi_mesic_do,cast_rostliny_skupina,cast_rostliny_je_kombinovana,poddomena_kategorie,poddomena_kategorie_confidence,status_contains_puvodni,status_contains_zdomacnely,status_contains_pestovany,status_contains_zplanujici,status_contains_invazni,status_cetnost
R120,Lamium album L.,hluchavka bílá,"původní, běžná",mladé vrcholky a listy,potrava,jarní zelenina,méně známé,vysoká,"meze, zahrady, dusíkaté okraje cest a plotů",III–V,mladé nezdřevnatělé vrcholky,Mladé vrcholky krátce spařit nebo přidat do směsi planých zelenin.,jarní zelená složka jídelníčku,"jemná, zelená",slabě bylinná,neaplikovateln?,sběr před znečištěním a vysemeněním,,běžný nechráněný druh,kurátorovaný botanický zdroj,D,S38,,"Praktické pro jaro, kdy bývá hojná.",120,False,False,potrava,mene_zname,vysoka,2,False,3,5,listova_nadzemni_cast,False,cerstva_potrava,medium,True,False,False,False,False,bezny
R121,Lamium album L.,hluchavka bílá,"původní, běžná",květy,léčba,folk bylinný čaj,téměř zapomenuté,střední,"meze, křoviny, zahrady",IV–IX,květ,V tradičních domácích herbářích jemný čaj; moderní formální opora slabá.,mírná domácí podpůrná bylina,"nasládlá, jemná",medově květová,neaplikovateln?,slabá důkaznost; nepoužívat jako náhradu péče při vážnějších potížích,,běžný nechráněný druh,folk zdroj / kurátorovaný přehled,E,S38,,Zahrnuto hlavně pro úplnost domácí tradice.,121,False,False,lecba,temer_zapomenute,stredni,1,False,4,9,kvetni_cast,False,caj_nalev,medium,True,False,False,False,False,bezny
R122,Lamium purpureum L.,hluchavka nachová,"zdomácnělá/původní, velmi běžná",mladé vrcholky,potrava,jarní salát / potherb,méně známé,vysoká,"trávníky, okraje cest, záhony, ruderály",III–V,mladá nať před ztvrdnutím,Použít střídmě do směsi planých jarních natí; samostatně bývá chuťově plošší.,snadno dostupná jarní zelenina,"jemná, lehce bylinná",slabě bylinná,neaplikovateln?,"sběr jen z čistých míst; lehká záměna s jinými hluchavkami nevadí zásadně, ale je třeba jistota",,běžný nechráněný druh,kurátorovaný botanický zdroj,D,S38,,"Skoro všude přítomná, ale málokdo ji vnímá jako jedlou.",122,False,False,potrava,mene_zname,vysoka,2,False,3,5,ostatni,False,cerstva_potrava,medium,True,True,False,False,False,velmi_bezny
R123,Alliaria petiolata (M.Bieb.) Cavara & Grande,česnáček lékařský,"původní, běžný",mladé listy,potrava,koření / pesto / salát,méně známé,vysoká,"stinné okraje cest, lesní lemy, křoviny, živé ploty",III–V,první rok růžice a časné jaro,"Mladé listy syrové jako česnekově-hořčičné koření, vhodné do pesta a pomazánek.",divoké koření a jarní listová zelenina,česnekově hořčičná,"výrazně bylinná, česneková",neaplikovateln?,po tepelné úpravě ztrácí část aroma; sběr mimo znečištěné okraje silnic,,běžný nechráněný druh,kurátorovaný botanický zdroj,D,S40,,Patří mezi nejlepší „procházkové“ kořenicové byliny v ČR.,123,False,False,potrava,mene_zname,vysoka,2,False,3,5,listova_nadzemni_cast,False,koreni_dochucovadlo,medium,True,False,False,False,False,bezny
R124,Alliaria petiolata (M.Bieb.) Cavara & Grande,česnáček lékařský,"původní, běžný",semena,potrava,koření,téměř zapomenuté,střední,"křoviny, meze, lesní lemy",VI–VIII,zralá semena,Semena rozdrtit a použít jako pikantní koření typu slabší hořčice.,kořenicí složka,"ostrá, hořčičná",kořenitá,neaplikovateln?,pracné získávání; nepřehánět množství,,běžný nechráněný druh,kurátorovaný botanický zdroj,D,S40,,Výrazně méně známé než použití listů.,124,False,False,potrava,temer_zapomenute,stredni,2,False,6,8,semena_a_orisky,False,koreni_dochucovadlo,medium,True,False,False,False,False,bezny
R125,Capsella bursa-pastoris (L.) Medik.,kokoška pastuší tobolka,"zdomácnělá, velmi běžná",mladé růžice,potrava,jarní zelenina,méně známé,vysoká,"cesty, záhony, pole, ruderály, štěrkové plochy",III–V,mladá listová růžice,Mladé listy syrové nebo krátce spařené; starší rostliny rychle hrubnou.,jarní zelenina a kořenicí akcent,hořčičně zelená,slabě kořenitá,neaplikovateln?,sběr mimo chemicky zatížená pole a příkopy,,běžný nechráněný druh,kurátorovaný botanický zdroj,D,S41,,"Typická „rostlina z chodníku a pole“, ale užitná.",125,False,False,potrava,mene_zname,vysoka,2,False,3,5,listova_nadzemni_cast,False,cerstva_potrava,medium,False,True,False,False,False,velmi_bezny
R126,Capsella bursa-pastoris (L.) Medik.,kokoška pastuší tobolka,"zdomácnělá, velmi běžná",semena,potrava,koření / semenná přísada,téměř zapomenuté,střední,"pole, ruderály, okraje cest",V–VIII,zralá semena,Drobounká semena lze použít jako pepřovitě-hořčičnou přísadu.,pikantní koření,pepřovitě hořčičná,kořenitá,neaplikovateln?,"pracné, snadno znečištěné; jen malé množství",,běžný nechráněný druh,kurátorovaný botanický zdroj,D,S41,,Spíš sběratelská kuriozita než objemová surovina.,126,False,False,potrava,temer_zapomenute,stredni,2,False,5,8,semena_a_orisky,False,koreni_dochucovadlo,medium,False,True,False,False,False,velmi_bezny
R127,Capsella bursa-pastoris (L.) Medik.,kokoška pastuší tobolka,"zdomácnělá, velmi běžná",nať,léčba,folk bylinné užití,téměř zapomenuté,střední,"ruderály, pole, náspy, cesty",IV–VIII,kvetoucí nať,V tradiční evropské i asijské herbální praxi se objevuje jako stahující bylina; zde vedeno jen jako slabě doložené folk použití.,folk domácí podpůrná bylina,"trpká, kořenitá",slabě bylinná,neaplikovateln?,nízká jistota a možné kontraindikace; opatrnost v těhotenství,nebrat jako bezpečné samoléčení,běžný nechráněný druh,kurátorovaný zdroj / přehledový článek,E,S41,,"Zařazeno kvůli tradici, nikoli kvůli silné moderní opoře.",127,False,False,lecba,temer_zapomenute,stredni,1,False,4,8,listova_nadzemni_cast,False,ostatni_specialni,low,False,True,False,False,False,velmi_bezny
R128,Viola odorata L.,violka vonná,"původní/zdomácnělá, běžná",květy,pití,sirup / kandování / aromatická dekorace,méně známé,vysoká,"křoviny, staré zahrady, hřbitovy, světlé lesy, městské stinné trávníky",III–IV,čerstvý květ,"Květy na sirup, kandování, cukr nebo jako jemně parfémovaná jedlá dekorace.",jemně parfémovaný nápoj či sladká surovina,sladce květová,"výrazně květová, fialková",neaplikovateln?,sběr jen z čistých ploch; drobné množství květů,,běžný nechráněný druh,kurátorovaný botanický zdroj,D,S39,,"Typický příklad silně vonné, ale dnes málo využívané plané rostliny.",128,False,False,piti,mene_zname,vysoka,2,False,3,4,kvetni_cast,False,sirup_koncentrat,medium,True,True,False,False,False,bezny
R129,Viola odorata L.,violka vonná,"původní/zdomácnělá, běžná",květy,vůně,vonné sáčky / cukr / macerát,méně známé,vysoká,"křoviny, staré sady, zahrady, světlé lesy",III–IV,čerstvý květ,"Květy krátkodobě provoní cukr, sirup nebo drobné vonné sáčky; sušením část vůně rychle mizí.",jemná květová parfemace,sladce květová,"výrazně květová, ale křehká",neaplikovateln?,vůně je prchavá; sušení je ztrátové,,běžný nechráněný druh,kurátorovaný botanický zdroj,D,S39,,Výborná na demonstraci rozdílu mezi silnou čerstvou a slabší sušenou vůní.,129,False,False,vune,mene_zname,vysoka,2,False,3,4,kvetni_cast,False,liker_macerat,medium,True,True,False,False,False,bezny
R130,Viola odorata L.,violka vonná,"původní/zdomácnělá, běžná",květy a listy,léčba,folk čaj,téměř zapomenuté,střední,"křoviny, světlé lesy, zahrady",III–V,čerstvý květ/list,V lidové tradici se objevuje mírně slizovitý květový či listový čaj pro krk a suchý kašel; moderní opora slabá.,folk zklidnění krku,jemná,jemně květová,neaplikovateln?,nízká důkaznost,,běžný nechráněný druh,folk zdroj / kurátorovaný přehled,E,S39,,"Zařazeno jako tradiční, nikoli oficiálně podložené.",130,False,False,lecba,temer_zapomenute,stredni,1,False,3,5,kombinovana_cast,True,caj_nalev,medium,True,True,False,False,False,bezny
R131,Oxalis acetosella L.,šťavel zaječí,"původní, běžný v lesích",listy,potrava,osvěžující kyselá nať,méně známé,vysoká,"stinné vlhčí lesy, bučiny, smrčiny, lesní cesty",IV–X,čerstvé listy,Listy po malých dávkách jako kyselý akcent do salátů nebo jen k přímému ochutnání na výletě.,osvěžující kyselý doplněk,výrazně kyselá,svěže zelená,neaplikovateln?,obsah oxalátů; ne ve velkých dávkách a ne pravidelně při sklonu ke kaménkům,,běžný nechráněný druh,kurátorovaný botanický zdroj,D,S42,,Velmi typická lesní „výletová“ rostlina.,131,False,False,potrava,mene_zname,vysoka,2,False,4,10,listova_nadzemni_cast,False,ostatni_specialni,low,True,False,False,False,False,bezny
R132,Oxalis acetosella L.,šťavel zaječí,"původní, běžný v lesích",listy,pití,osvěžující nálev,téměř zapomenuté,střední,vlhké lesy a lesní lemy,IV–VIII,čerstvé listy,Slabý kyselý nálev jako osvěžující sezonní kuriozita.,osvěžující nápoj,kyselá,svěže zelená,neaplikovateln?,oxaláty; jen malé množství,,běžný nechráněný druh,kurátorovaný botanický zdroj,E,S42,,Kuriozita spíš pro znalce než praktický základ.,132,False,False,piti,temer_zapomenute,stredni,1,False,4,8,listova_nadzemni_cast,False,caj_nalev,medium,True,False,False,False,False,bezny
R133,Arctium lappa L.,lopuch větší,"původní/zdomácnělý, běžný",kořen 1. roku,potrava,kořenová zelenina,méně známé,střední,"ruderály, okraje cest, náspy, skládky zeminy, vesnické okraje",IX–III,první rok růžice bez květní lodyhy,"Kořen prvoroční rostliny jako „gobo analog“: oloupat, povařit nebo restovat.",kořenová zelenina a globální analog,"zemitá, mírně sladká",slabá kořenová,neaplikovateln?,druhý rok kořen tvrdne; sběr jen s jistou identifikací a z čisté půdy,,běžný nechráněný druh,kurátorovaný botanický zdroj,D,S43,,Jeden z nejzajímavějších příkladů globální znalosti dobře přenositelné do ČR.,133,False,False,potrava,mene_zname,stredni,2,False,9,3,podzemni_cast,False,cerstva_potrava,medium,True,True,False,False,False,bezny
R134,Arctium lappa L.,lopuch větší,"původní/zdomácnělý, běžný",řapíky a mladé stonky,potrava,jarní zelenina,téměř zapomenuté,střední,"ruderály, okraje polí a cest",IV–V,časné jaro před hrubnutím,"Oloupané mladé řapíky a stonky lze krátce povařit; pracné, ale použitelné.",doplněk jarní zeleniny,"zelená, lehce nahořklá",slabá,neaplikovateln?,pracnost a snadná záměna stáří rostliny,,běžný nechráněný druh,kurátorovaný botanický zdroj,D,S43,,Typicky zapomenuté využití oproti známějšímu kořeni.,134,False,False,potrava,temer_zapomenute,stredni,2,False,4,5,listova_nadzemni_cast,False,cerstva_potrava,medium,True,True,False,False,False,bezny
R135,Malva sylvestris L. / Malva neglecta Wallr.,sléz lesní / sléz přehlížený,"původní/zdomácnělý, běžný",listy,potrava,slizovitá zelenina / zahušťovadlo,méně známé,vysoká,"vesnické okraje, cesty, dvory, ruderály, zahrady",V–IX,mladé listy,"Listy do polévek a zeleninových směsí, kde příjemně zahustí díky slizům.",jedlá listová zelenina a jemné zahuštění,"jemná, slizovitá",nevýrazná,neaplikovateln?,textura nemusí vyhovovat každému; sběr z čistých míst,,běžný nechráněný druh,EMA podklad + kurátorovaný botanický zdroj,C,S34,,Dobře ukazuje překryv mezi potravinou a léčivým slizem.,135,False,False,potrava,mene_zname,vysoka,3,False,5,9,listova_nadzemni_cast,False,cerstva_potrava,medium,True,True,False,False,False,bezny
R136,Malva sylvestris L. / Malva neglecta Wallr.,sléz lesní / sléz přehlížený,"původní/zdomácnělý, běžný",list a květ,léčba,slizovitý nálev,méně známé,vysoká,"ruderály, dvory, okraje cest, zahrady",V–IX,mladý list a květ,Tradiční demulcentní bylina pro podrážděnou sliznici v ústech a krku; v datech vedeno obecně.,zklidnění sliznic,jemná,lehce květová,neaplikovateln?,při přetrvávání obtíží neodkládat lékaře; slizy mohou teoreticky ovlivnit vstřebávání některých léků při současném užití,časový odstup od léků je rozumný,běžný nechráněný druh,EMA assessment report,A,S34,,Jedna z kvalitněji podložených „procházkových“ rostlin.,136,False,False,lecba,mene_zname,vysoka,5,False,5,9,kombinovana_cast,True,caj_nalev,medium,True,True,False,False,False,bezny
R137,Malva sylvestris L. / Malva neglecta Wallr.,sléz lesní / sléz přehlížený,"původní/zdomácnělý, běžný",květy,potrava,jedlé květy,méně známé,vysoká,"ruderály, zahrady, okraje cest",VI–IX,čerstvé květy,Květy jako jedlá dekorace nebo jemná složka čajových směsí.,dekorace a jemný aromatický doplněk,mírná,jemně květová,neaplikovateln?,sběr z čistých ploch,,běžný nechráněný druh,EMA podklad / kurátorovaný botanický zdroj,C,S34,,Zajímavé propojení jedlosti a léčebného slizu.,137,False,False,potrava,mene_zname,vysoka,3,False,6,9,kvetni_cast,False,ostatni_specialni,low,True,True,False,False,False,bezny
R138,Verbascum densiflorum Bertol. / V. thapsus L. / V. phlomoides L.,divizna,"původní/zdomácnělá, běžná",květ,pití,nálev při suchém kašli,mainstream,vysoká,"suché stráně, náspy, okraje cest, paseky, ruderály",VI–IX,čerstvě rozkvetlý květ za sucha,"Sbírat jednotlivé květy za sucha, rychle a šetrně sušit; klasický diviznový čaj.",podpora při suchém kašli a podrážděném krku,"jemná, lehce medová",jemně medová,neaplikovateln?,"chloupky mohou dráždit, proto čaj pečlivě přecedit",při dušnosti nebo horšení stavu neodkládat péči,běžný nechráněný druh,EMA monografie,A,S33,,Jedna z nejpraktičtějších běžně potkatelných léčivek.,138,False,False,piti,mainstream,vysoka,5,False,6,9,kvetni_cast,False,caj_nalev,medium,True,True,False,False,False,bezny
R139,Verbascum densiflorum Bertol. / V. thapsus L. / V. phlomoides L.,divizna,"původní/zdomácnělá, běžná",suchá lodyha,palivo,pochodeň / podpal,téměř zapomenuté,střední,"suché stráně, náspy, paseky",IX–III,suchá odumřelá lodyha,Suché lodyhy historicky sloužily jako improvizovaná pochodeň nebo rychlý podpal.,"rychlé rozhoření, demonstrace starého užití",,,nízký až střední jako podpal,"pracuje jen jako rychlý podpal, ne plnohodnotné palivo",hořlavý materiál používat opatrně,sběr suchých zbytků z běžných ploch; nepoškozovat živé rostliny,historicko-etnobotanický zdroj,D,S33,,Dobrá ukázka „paliva“ mimo dřeviny.,139,False,False,palivo,temer_zapomenute,stredni,2,False,9,3,listova_nadzemni_cast,False,palivo,medium,True,True,False,False,False,bezny
R140,Crataegus monogyna Jacq. / C. laevigata (Poir.) DC.,hloh obecný / jednosemenný,"původní, běžný",malvice,potrava,povidla / želé / sušený plod,méně známé,vysoká,"meze, křoviny, lesní lemy, staré sady, remízky",IX–X,plně vybarvený měkčí plod,"Plody po tepelné úpravě na protlaky, želé nebo ovocnou kůži; syrové bývají moučnaté.",podzimní plané ovoce,"moučnatě sladká, trpká",slabá ovocná,neaplikovateln?,"pecky, trpkost a pracnost; sběr mimo prašné silnice",,běžný nechráněný druh,etnobotanika + oficiální monografie pro jinou část drogy,C,S32,S30,"Plody jsou prakticky využitelné, ale sbírá je málo kdo.",140,False,False,potrava,mene_zname,vysoka,3,True,9,10,plodova_cast,False,zavarenina,medium,True,False,False,False,False,bezny
R141,Crataegus monogyna Jacq. / C. laevigata (Poir.) DC.,hloh obecný / jednosemenný,"původní, běžný",list s květem,fytoterapie,nálev / extrakt,méně známé,vysoká,"meze, křoviny, lesní lemy, remízky",V,plné kvetení,Oficiálně vedená tradiční droga pro mírný stres a některé dočasné nervózní srdeční obtíže po vyloučení závažné příčiny.,"mírný stres, spánek, nervózní palpitace",jemně trpká,slabě květová,neaplikovateln?,nepoužívat jako samoléčbu u skutečných kardiálních příznaků,"při bolesti na hrudi, dušnosti nebo otocích vždy lékař",běžný nechráněný druh; netrhat nadměrně celé větve,EMA monografie,A,S32,,Silněji podložený záznam než většina planých keřů.,141,False,False,fytoterapie,mene_zname,vysoka,5,False,5,5,kombinovana_cast,True,caj_nalev,medium,True,False,False,False,False,bezny
R142,Rubus fruticosus agg.,ostružiník křovitý,"původní/zdomácnělý, velmi běžný",plody,potrava,čerstvé ovoce / džem,mainstream,vysoká,"křoviny, paseky, náspy, okraje lesů, meze",VII–IX,plně černé zralé plody,Sbírat jen plně zralé plody; výborné čerstvé i na zavaření.,plané ovoce,sladce kyselá,ovocná,neaplikovateln?,"paraziti nízko u země, plísně a prach u cest",,běžný nechráněný druh,kurátorovaný botanický zdroj,C,S48,S30,Jedna z nejpraktičtějších běžných planých plodin.,142,False,False,potrava,mainstream,vysoka,3,True,7,9,plodova_cast,False,zavarenina,medium,True,True,False,False,False,velmi_bezny
R143,Rubus fruticosus agg.,ostružiník křovitý,"původní/zdomácnělý, velmi běžný",listy,pití,listový čaj,méně známé,střední,"křoviny, paseky, lesní lemy",V–VIII,zdravé mladší listy,Sušené listy na jednoduchý bylinný čaj nebo do směsí.,svíravý čaj,trpká,slabě zelená,neaplikovateln?,trpkost; jen zdravé neplesnivé listy,,běžný nechráněný druh,kurátorovaný botanický zdroj,D,S48,,"V českém prostoru méně známé než plody, ale praktické.",143,False,False,piti,mene_zname,stredni,2,False,5,8,listova_nadzemni_cast,False,caj_nalev,medium,True,True,False,False,False,velmi_bezny
R144,Thymus serpyllum agg.,mateřídouška,"původní, běžná lokálně",nať,pití,aromatický čaj,mainstream,vysoká,"suché stráně, písčiny, meze, skalnatější trávníky",V–VIII,na začátku květu,Kvetoucí nať na aromatický čaj; sušit rychle a ve stínu.,aromatický nápoj a domácí čajová bylina,"kořenitá, lehce nahořklá","silně aromatická, tymiánová",neaplikovateln?,silice mohou vadit citlivým osobám; nepřehánět dávky,,"běžný nechráněný druh, ale lokálně sbírat šetrně",botanický zdroj + analogie s tymiánem,C,S47,S06,Velmi typická rostlina českých mezí a strání.,144,False,False,piti,mainstream,vysoka,3,True,5,8,listova_nadzemni_cast,False,caj_nalev,medium,True,False,False,False,False,lokalne_bezny
R145,Thymus serpyllum agg.,mateřídouška,"původní, běžná lokálně",nať,potrava,koření,mainstream,vysoká,"suché louky, stráně, meze",V–VIII,kvetoucí vrcholky,"Používat jako divoké koření podobné tymiánu, ale jemnější a „krajinovější“.",aromatizace jídla,kořenitá,silně kořenitá,neaplikovateln?,sběr jen po malých částech z více trsů,,běžný nechráněný druh,kurátorovaný botanický zdroj,C,S47,,Pro kuchyň často praktičtější než mnoho jiných planých bylin.,145,False,False,potrava,mainstream,vysoka,3,False,5,8,listova_nadzemni_cast,False,koreni_dochucovadlo,medium,True,False,False,False,False,lokalne_bezny
R146,Thymus serpyllum agg.,mateřídouška,"původní, běžná lokálně",nať,fytoterapie,čaj při nachlazení,méně známé,střední,suché stráně a meze,V–VIII,kvetoucí nať,"Tradiční respirační použití je plausibilní a druh je blízký kuchyňskému tymiánu, ale formální EMA monografie cílí na jiné druhy thymu.",kašel a nachlazení v tradičním smyslu,kořenitá,tymiánová,neaplikovateln?,důkaznost nižší než u Thymus vulgaris; opatrnost u malých dětí a v těhotenství,neplést s osobním medicínským doporučením,běžný nechráněný druh,analogie s EMA + kurátorovaný botanický zdroj,D,S47,S06,"Přesně označeno jako přenositelná, ale ne plně totožná analogie.",146,False,False,fytoterapie,mene_zname,stredni,2,True,5,8,listova_nadzemni_cast,False,caj_nalev,medium,True,False,False,False,False,lokalne_bezny
R147,Humulus lupulus L.,chmel otáčivý,"původní/zdomácnělý, běžný",mladé výhonky,potrava,jarní zelenina,téměř zapomenuté,střední,"křoviny, lesní lemy, břehy, ploty, staré sady",III–IV,mladé křehké výhony,Mladé výhonky krátce blanšírovat nebo restovat; chuťově připomínají chřestové jarní výhonky.,jarní delikatesa / globální analog,"jemně hořká, zelená",slabá zelená,neaplikovateln?,pracné hledání a potřeba jisté identifikace; jen malé množství,,běžný nechráněný druh,kurátorovaný botanický zdroj,D,S44,,"Výborný příklad luxusního, ale skoro zapomenutého sběru z výletu.",147,False,False,potrava,temer_zapomenute,stredni,2,False,3,4,vyhonky_a_pupeny,False,cerstva_potrava,medium,True,True,False,False,False,bezny
R148,Humulus lupulus L.,chmel otáčivý,"původní/zdomácnělý, běžný",samičí šištice,pití,pivní hořčina / bylinný nálev,mainstream,vysoká,"ploty, křoviny, břehy, staré sady",VIII–IX,zralé aromatické šištice,Známé pivovarské použití; mimo pivo i do hořkých bylinných směsí a nálevů.,hořčení a aromatizace nápojů,"hořká, pryskyřičná",pryskyřičně bylinná,neaplikovateln?,sedativní efekt a hořkost; opatrnost při současném užívání uklidňujících látek,může zesilovat ospalost,"běžný nechráněný druh; sbírat jen tam, kde to je vhodné",kurátorovaný botanický zdroj / tradiční evropská praxe,C,S44,,Na procházkách překvapivě častý v křovinách a starých plotech.,148,False,False,piti,mainstream,vysoka,3,False,8,9,semena_a_orisky,False,caj_nalev,medium,True,True,False,False,False,bezny
R149,Humulus lupulus L.,chmel otáčivý,"původní/zdomácnělý, běžný",samičí šištice,vůně,polštářek / aromatický sáček,méně známé,vysoká,"křoviny, staré sady, ploty",VIII–IX,čerstvě sklizené šištice,Sušené šištice do aromatických polštářků a sáčků; tradičně spojováno s večerním zklidněním.,vonná a mírně sedativní atmosféra,,"pryskyřičně bylinná, chmelová",neaplikovateln?,citlivost na aroma u některých osob,"mírně uklidňující tradice, ne léková jistota",běžný nechráněný druh,kurátorovaný botanický zdroj,D,S44,,Dobře zapadá do tvé kategorie vůní.,149,False,False,vune,mene_zname,vysoka,2,False,8,9,semena_a_orisky,False,vune_a_vykurovani,medium,True,True,False,False,False,bezny
R150,Chenopodium album L.,merlík bílý,"zdomácnělý, velmi běžný",mladé listy,potrava,potherb / „špenát“,méně známé,vysoká,"záhony, pole, ruderály, okraje cest, komposty",V–VIII,mladé listy před kvetením,Mladé listy vařit jako špenát; syrové spíše v menším množství.,objemná planá zelenina,"jemně moučnatá, zelená",nevýrazná,neaplikovateln?,obsah oxalátů a saponinů; vyhýbat se silně hnojeným nebo znečištěným plochám,,běžný nechráněný druh,kurátorovaný botanický zdroj,D,S45,,Patří mezi nejvýnosnější běžně potkávané jedlé plevele.,150,False,False,potrava,mene_zname,vysoka,2,False,5,8,listova_nadzemni_cast,False,cerstva_potrava,medium,False,True,False,False,False,velmi_bezny
R151,Chenopodium album L.,merlík bílý,"zdomácnělý, velmi běžný",semena,potrava,kaše / příměs do mouky,téměř zapomenuté,střední,"ruderály, pole, úhory",VIII–X,zralá suchá semena,Drobné semeno lze po pracném čištění použít jako příměs do kaší nebo pečiva.,nouzová či experimentální semenná surovina,oříškově neutrální,nevýrazná,neaplikovateln?,pracnost a drobná velikost; jen čisté porosty,,běžný nechráněný druh,kurátorovaný botanický zdroj,D,S45,,Spíš znalostní bonus než každodenní praxe.,151,False,False,potrava,temer_zapomenute,stredni,2,False,8,10,semena_a_orisky,False,ostatni_specialni,low,False,True,False,False,False,velmi_bezny
R152,Plantago major L.,jitrocel větší,"původní/zdomácnělý, velmi běžný",mladé listy,potrava,listová zelenina po úpravě,méně známé,vysoká,"cesty, dvory, trávníky, sešlapávané plochy",III–V,mladé listy před vytaháním vláken,Mladé listy po krátkém blanšírování; starší bývají tuhé a vláknité.,jarní zelenina z velmi běžného druhu,mírně nahořklá,slabě zelená,neaplikovateln?,vláknitost starších listů; snadná kontaminace sešlapávaných míst,,běžný nechráněný druh,kurátorovaný botanický zdroj,D,S46,,"Praktická, ale často opomíjená alternativa k jitroceli kopinatému.",152,False,False,potrava,mene_zname,vysoka,2,False,3,5,listova_nadzemni_cast,False,cerstva_potrava,medium,True,True,False,False,False,velmi_bezny
